content	person
交警让违章司机写检查及格者可放行(图)卷面干净和语言通顺10分定性自己的违法行为30分思路清晰的改正措施30分认识违法行为的后果30分“我认识到了自己的错误，今后一定改正。”别以为你看到的是某个学生的检讨，这可是违法司机的“检查”。交警采取这样的教育方式，还有专门的打分标准，及格了，就能免予被拘留的处罚。交警表示，此举更多的是教育意义。-商报记者邢军通讯员李东亚半小时内查到7辆违法车昨日上午10时许，郑州市交警三大队民警，在郑密路黄岗寺附近进行交通整治活动。这里连接着郑石高速的入口，大货车、长途客车经常聚集，客车上下人也引来了很多拉客的机动三轮车，导致原本就繁忙的郑密路通行更不畅。民警在路口一边疏导交通，一边查处违法车辆。半个小时后，民警就查扣了7名司机的车辆，他们中4人是无证驾驶，1人驾车没带驾驶证，1人驾车逆行，1人驾车拉货但没关后车门。随后，这7名司机都被带到交警三大队春晖路事故停车场接受处理。事故车前先上堂警示课据交警郑敏军讲，按照交通法的规定，无证驾驶要被处以15日以下拘留，1500元以下罚款。如果按照这种标准，有5人面临很严厉的处罚。但事实上，交警并没有对他们采用这种简单的罚款、拘留的方式，而是重点进行批评教育。在事故停车场内，民警郑敏军将7人带到了一辆已成废铁的事故轿车旁，告诉他们：11月21日，在郑密路上，一辆东风大货车在违法超车时，从右前侧撞上这辆比亚迪F3轿车，轿车被撕裂为两半，轿车司机当场死亡。而货车司机也为自己的行为付出了惨痛的代价。“很多事故都是由我们违法驾驶导致的，眼前就是一个很惨痛的教训。”郑敏军说。“及格”可免予拘留处罚之后，民警给每个人发了一张纸，让他们看事故写“故事”，分4个部分。而且，交警还给他们宣读了打分标准，及格线为60分，及格了可免予拘留处罚。评分标准是这样定的：第一部分是卷面干净，语言通顺，10分；第二部分是给自己的违法行为定性，要全面准确，30分；第三部分是对此行为的改正措施，要思路清晰，30分；第四部分是违法行为的后果，要认识到位，30分。“我叫华廷杰，4日上午被交警查了，我没有驾驶证，违反了法律，以后一定吸取这个教训，安全驾驶。”这是华廷杰所写的“故事”的一段，小学毕业的他写得很专心。“该咋说咋说，俺确实不对，以后一定改。”司机苏建国说。“其实打分只是一种形式，主要是看他们态度如何。作为交警的一种管理手段，可以对认错态度好的司机减轻或免予处罚。”交警郑敏军说，同时，这就相当于一份保证书，如果下次再被交警查到，就要按法律来处理了。	华廷杰,郑敏军,邢军,苏建国,李东亚
热刺欲劫阿森纳1500万猎物铁闸从未说过想去枪手新浪体育讯　号称“暴力本”的布莱克本上赛季防守强悍，他们的中卫搭档功不可没。有“新特里”之称的菲尔-琼斯，在夏窗开启伊始就被曼联抢购；而现在，他们的队长克里斯-桑巴也成了转会市场上的香饽饽。据《每日邮报》报道，热刺已经提升了他们对桑巴的兴趣，桑巴的经纪人将在近几天内同两位潜在买家——阿森纳和热刺展开转会谈判。看来，热刺不但在赛场上同阿森纳是德比死敌，在转会方面也想和枪手正面交锋，一争高下。这个夏天，热刺没有同伍德盖特续约，前英格兰国脚成为自由球员之后被斯托克城签下；莱德利-金做了膝盖手术，无缘季前备战。仅有加拉、道森、卡布尔、巴松四员中卫，在雷德克纳普看来，是无法应付英超、欧联杯、足总杯、联赛杯多线作战的，因而，老雷将目光投向了桑巴。据悉，桑巴的标价是1500万英镑。《太阳报》日前曾报道，桑巴亲口表示想加盟阿森纳，但桑巴坚称他从未说过这样的话。他在推特上发布了一条微博：“关于我的报道完全是假的——我从没说过那些话。我是布莱克本球员，我永远不会说想要加盟别的俱乐部，那是对东家的不尊重。我现在很不开心。”(哈利)	桑巴,伍德盖特,菲尔-琼斯,巴松,加拉,特里,道森,莱德利-金,克里斯-桑巴,雷德克纳普,本,老雷,哈里,杰拉德
日本首相和民主党干事长收到装子弹威胁信日本首相鸠山由纪夫和执政党民主党干事长小泽一郎28日同时收到装有子弹的威胁信。日本内阁官房副长官松野赖久表示，首相办公室当天收到了一封疑似装有子弹的信，随即将这封没有打开的信交给了警方。警方在使用X光进行扫描后证实说，信里确实装有一枚子弹。此外，警方还发现信封里有一张写着“死”的纸条。东京警方表示，执政党民主党干事长小泽一郎的办公室当天也收到了一封装有子弹的威胁信。小泽一郎的秘书于当天下午5点半左右在新乡里发现了这封含有子弹的威胁信，并报告了警察。除了子弹外，这封信内还附有一张卡片，警方称，寄信者在卡片上要求小泽一郎辞职。目前还不清楚这些威胁信是由何人寄出。有关官员猜测，子弹威胁信针对的主要目标可能是小泽。在鸠山政府去年9月上台后，小泽一郎的办公室和住所、民主党总部以及日本朝日电视台都曾收到过抨击小泽的子弹信。目前鸠山和小泽均身陷政治献金丑闻。而鸠山为小泽辩护，引起了日本在野党和公众的不满。（马晶）	小泽一郎,小泽,松野赖久,鸠山,马晶,鸠山由纪夫
央广广播电视网络台获准成立中广网北京8月30日消息(记者赵明明)中央人民广播电台日前正式获得国家广电总局批准建立“央广广播电视网络台”(Chinanationalbroadcastingnetwork，缩称CNBN)，这是继中国网络电视台CNTV之后，又一个获准建立的中央级网络广播电视台。央广广播电视网络台作为以网络视听节目传播及互动服务为核心的跨网络、跨终端、全媒体的新媒体播出机构，将依托重点新闻网站中国广播网、你好台湾网、中国民族广播网、中国广播联盟和全球华语广播联盟成员台等全球顶级传媒机构的优势资源共同打造，开办互联网广播电视、手机广播电视、车载信息娱乐门户等业务，为受众提供定制化内容服务的全方位解决方案。央广广播电视网络台的正式成立，标志着具有70年历史的中央人民广播电台全媒体战略加速推进。此前，央广作为全球拥有最大听众群体且唯一覆盖全国的广播电台，在引领广播传媒发展的同时，也全面进军电视和新媒体领域。三网融合背景下，网络广播电视台的获批将加快央广打造国家级综合网络视听传播平台步伐，成为中央人民广播电台构建一流的全媒体现代国家传媒机构的重要支撑。	赵明明
价格太高中国连续两周未进口美国大豆卢进高企的美国大豆价格正在令买家望而却步。在截至6月4日的两周内，全球最大的大豆进口国——中国已经没有出现在美国大豆买家的列表当中，不仅如此，在过去的两周内，中国还将此前确定的进口量削减了十多万吨。昨日，美国农业部(USDA)公布了截至6月4日的一周出口销售报告，当周美国2008/2009年度(2008年9月1日起)大豆净出口销售量为-6.1万吨，远远低于此前分析师预计的20万~30万吨水平。在这一周内，中国削减进口量5.5万吨。而在截至5月28日的一周内，美国大豆出口量同样也为负值。当周，大豆净出口量为-2.4万吨，中国削减进口11.26万吨。今年以来，由于美国大豆价格相对便宜，阿根廷大豆产量因干旱原因大幅减少，包括中国在内的大豆进口国对美国大豆的需求高涨。据USDA统计，截至5月28日，美国2008/2009年度大豆累计出口销售量为3373.63万吨，去年同期为3001.43万吨。中国累计购买美豆1846.91万吨，去年同期为1342.67万吨。美国大豆的“疯狂”出口使得该国大豆库存快速下降，USDA周三的月度报告预计，2008/2009年度，美国大豆期末库存仅1.1亿蒲式耳(约合300万吨)，这将是1973年以来的最低库存量。在库存吃紧的情况下，美国大豆在过去三个月内快速上涨，截至昨日北京时间22点，芝加哥商品交易所(CBOT)大豆7月合约期价报1260美分/蒲式耳，较3月中旬上涨了近45%。此前便宜的美国大豆，现在变得非常昂贵。据黑龙江天琪期货估算，如果按照目前的大豆期货价格点价进口，美国大豆到达中国港口的成本价将高达4300元/吨，这远远高于3600~3800元/吨的国产大豆价格。在高企的大豆价格面前，中国只好对美国大豆“退避三舍”。	
Gateway连发三款AMDAPU笔记本宏?旗下“奶牛”Gateway今天发布了三款NV系列笔记本，全部采纳了AMDBrazosAPU融合平台。这三款新本都是15.6寸机型，型号分别为NV51B08u、NV51B05u、NV51B02u，LED背光液晶屏分辨率为1366×768，整体采用深紫色调，A面外壳还装饰了波浪条纹，整体尺寸381×253×31-34.14毫米，重量约2.6公斤。NV51B08u采用了一颗双核心的C-501.0GHz，集成显卡RadeonHD6250，搭配A50M单芯片组、3GBDDR3内存、320GB5400转硬盘。NV51B05u、NV51B02u则都使用了双核心的E-3501.6GHz，集成显卡RadeonHD6310，前者搭配3GBDDR3内存、500GB5400转硬盘，后者搭配2GB内存、320GB5400转硬盘。其他通用配置还有：千兆以太网卡、Wi-Fi802.11b/g/n无线网卡、HDAudio声卡、8xDVD刻录机、全尺寸键盘、多点触摸板、130万像素摄像头、MMC/SD二合一读卡器、VGA/HDMI输出接口、三个USB2.0接口、六芯4400毫安锂离子电池(续航时间最长4.7小时)、Windows764位家庭高级版操作系统。E-350NV51B05u现在可以通过官方网站购买，标价469.99美元。另外两款NV51B08u、NV51B02u暂时无货，价格也没有具体标明，据说前者要399美元，后者则应介于二者之间。	
期指新老空军司令分歧加大□晨报记者张佳?昨日A股在权重股带领下小幅微调，沪深300指数下跌15点，跌幅为0.43%，最终报收于3466.08点。而期指合约表现大体与现货相若。近期合约方面，IF1011合约下跌23点，跌幅为0.64%，报收3558.20点，期现货价差跌破100点报收92.12点，全日共成交235559张，未平仓合约数为29142张，较上一交易日减少1384张；IF1012合约则下跌21.40点，跌幅0.59%，报收3591.60点，期现货价差为125.52点，全日共成交13614张，未平仓合约数为7798张，较上一交易日增加247张。远期合约方面，IF1103合约下跌20.20点，跌幅0.55%，报收3655点，期现货价差为188.92点，全日共成交1377张，未平仓合约数为2198张，较上一交易日增加283张；IF1106合约则下跌13.8点，跌幅为0.37%，报收3710.4点，期现货价差为244.32点，全日共成交251张，未平仓合约数为456张，较上一交易日增加48张。从昨日主力合约IF1011合约的期现货价差日内走势来看，高企不下的期现货价差值终于因为昨日下午的一波小幅跳水而有所缩窄。昨天上午，期现货价差大多数时间是在105点至135点之间盘整，但到下午跳水后，一度最低不过85点左右，虽然此后由于沪深300指数并未继续跳水期现货价差有所回升，但是也不过是在95点至105点之间盘整。虽然期现货价差收窄，但是对套利者而言依然有2.66%的套利空间，考虑到这是不足一个月的套利收益，还是极为可观的。中金所披露的持仓数据显示，昨日老牌“空军司令”国泰君安持有的多单为2264张，较上一交易日减少70张；持有的空单为5232张，较上一交易日减少260张，净空单数减少190张至2968张。至于新锐“空军司令”中证期货，持有的多单为1843张，较上一交易日锐减464张，持有的空单为5643张，较上一交易日增加71张，净空单数增加535张至3800张。对于后市，新老“空军司令”出现了分歧，国泰君安虽然并没有积极做多，但至少在减少总头寸的同时略微偏多，而中证期货却是在大举减持空单的同时轻微增持空单，看空的意味要明显强于国泰君安。	
春风欧赔解析：米兰双雄齐获胜塞维利客场取三分01乌迪内VS那不勒推介：3099家公司即时欧洲平均赔率：2.403.062.94那不勒斯本赛季实力的状态远高于乌迪内斯，但乌迪内主场成绩还不错，赔率略看淡客队。交战史那不勒斯占优，赔率异常建议双选两头。02博洛尼VSAC米兰推介：099家公司即时欧洲平均赔率：4.563.291.79AC米兰经过前两轮的挫折，本场比赛急需一场胜利来稳住第2的位置，客场成绩5胜3平2负。博洛尼亚实力很一般，虽然AC米兰时客场作战，但看好AC米兰有这个实力客场获胜。03亚特兰VS巴里推介：3199家公司即时欧洲平均赔率：2.293.083.13亚特兰本赛季发挥不佳排名联赛第19位，主场成绩2胜3平5负。巴里排名联赛第9位，客场成绩1胜5平5负。交战记录上亚特兰大占优，但实力上巴里更佳，赔率更看好主队，双选主队不败。04拉齐奥VS卡塔尼推介：399家公司即时欧洲平均赔率：1.903.214.12本场比赛可考虑用拉齐奥做博胆，拉齐奥排名联赛第15位，主场成绩3胜4平4负，成绩一般。卡塔尼排名第18位，客场成绩1胜4平8负。拉齐奥占有明显优势，小单直接博单3。05国米VS卡利亚推介：399家公司即时欧洲平均赔率：1.364.348.56没有悬念的比赛，国米赢得了难得的喘息机会，本场比赛又是主场作战，爆冷几率基本为0。卡利亚排名联赛第8位，客场成绩4胜2平4负。主流博彩公司一致看好主队大胜，直接用国米获胜做胆。06热那亚VS切沃推介：3099家公司即时欧洲平均赔率：1.883.234.16热那亚排名联赛第10位，主场成绩7胜3平1负，主场成绩很好。切沃排名联赛第12位，客场成绩4胜2平5负。两队交锋史热那亚处于劣势，防冷要防大冷0。07锡耶纳VS桑普多推介：3099家公司即时欧洲平均赔率：2.603.052.70锡耶纳全联盟垫底，每一场比赛都是保级大战。桑普多排名联赛第7位，客场成绩3胜1平7负，不是很好，虽然桑普多实力强于对手，但考虑到锡耶纳是主场作战，3一定要选，其次选择0。08佛罗伦VS罗马推介：1099家公司即时欧洲平均赔率：2.453.102.85两支老牌强队的对抗因为佛罗伦萨本赛季的状况不佳而减少了很多关注度，佛罗伦排名联赛第11位，罗马排名联赛第3位。罗马最近状态奇佳，交锋史罗马有非常大的优势，建议双选客队不败。09萨拉戈VS塞维利推介：099家公司即时欧洲平均赔率：3.373.262.08塞维利亚拥有实力上的绝对优势，萨拉戈排名联赛第18位，主场成绩3胜3平3负。塞维利排名联赛第4位，客场成绩5胜0平4负。在主场战胜瓦伦西亚状态后，塞维利亚恢复到最近状态，本场比赛大胜可期。10阿尔梅VS希洪推介：399家公司即时欧洲平均赔率：2.133.203.30阿尔梅排名联赛第16位，主场成绩3胜4平2负。希洪排名联赛第11位，客场成绩1胜3平5负。本场比赛的关键是交锋史阿尔梅6场全胜，阿尔梅就是希洪的克星，本场比赛有望继续延续这一规律。11奥萨苏VS特内里推介：399家公司即时欧洲平均赔率：1.793.374.42本场比赛可以用来做博胆，奥萨苏排名联赛第10位，主场成绩3胜3平3负。特内里排名联赛第19位，客场成绩0胜2平7负。特内里客场成绩是在太差，用奥萨苏做胆。12马洛卡VS维拉利推介：3099家公司即时欧洲平均赔率：2.303.212.95维拉利实力已经基本恢复到上赛季的水平，虽然马洛卡本赛季联赛主场全胜，但维拉利尔并客场作战非没有胜机，赔率也对主队获胜持保留意见，建议防冷0。13桑坦德VS马竞技推介：3099家公司即时欧洲平均赔率：2.463.192.76马竞周中国王杯主场4-0大胜桑坦德，本场比赛是两队连续碰撞，桑坦德拥有主场优势，有希望在主场复仇，不过交战史客队占优，建议双选两头。14马拉加VS拉科鲁推介：1099家公司即时欧洲平均赔率：2.343.202.91拉科鲁拥有绝对实力优势，虽然是客场作战依然有很大的取胜希望，两队交锋史旗鼓相当，赔率看好主队更多的是诱盘行为，建议双选客队不败。更多推荐关注春风的新浪博客	
恒大穆里奇：足协的处罚很不公平但我接受与服从新浪体育讯　8月16日，中国足协对广州恒大(微博)球员穆里奇(微博)做出停赛5场的处罚，这也让本赛季表现一直非常出色的这位巴西外援遭受到了非常大的打击。自从得知自己被足协处罚的消息之后，穆里奇的心情非常不好，巴西人现在非常后悔自己给球队造成的影响。对于自己受到的处罚，穆里奇说：我认为足协的处罚很不公平，但我还是能够接受与服从。在16日这一天，穆里奇分别受到了广州恒大俱乐部与中国足协的处罚，这让平时性格开朗的巴西人立刻陷入了苦恼之中，特别是得知自己被禁赛5场比赛之后，穆里奇的心情相当不好，一直把自己关在房间里，好在有妻子别在他的身边一直开导他，所以直到处罚过去了近20个小时之后，穆里奇才走出房门，在17日中午才吃了20个小时之中的第一顿饭。新浪体育也通过恒大队的翻译与穆里奇取得了联系，穆里奇说到：自己现在很想感谢妻子，在自己遇到困难的时候，是他一直陪在身边，自己也很感谢俱乐部，他们也一直安慰自己。谈到这次受到的处罚，穆里奇说到：我觉得足协对我的处罚并不公平，我并没有去暴力伤害谁，但现在既然已经处罚了，不管公平不公平我接受。我想说的是，我很感谢俱乐部，虽然俱乐部也处罚了，但我首先接受俱乐部的处罚，我觉得俱乐部对我的处罚是为了帮助我。既然我能够接受俱乐部的处罚，所以也要接受与服从足协的处罚。对于自己停赛给球队造成的影响，这才是让穆里奇感到最难过的地方：俱乐部一直对我非常好，在各个方面都给我非常很大帮助，我一直很渴望用好的表现回报俱乐部与球队，但现在我不能参加比赛，我感到很难过，我希望我的队友通过在我停赛的期间帮助球队取得好成绩。(新浪体育于静(微博))	于静,穆里奇
组图：怀恩豪斯搭上黑人保镖夜店调情卿卿我我新浪娱乐讯北京时间8月10日消息，据国外媒体报道，英国当地时间8月9日晚上，歌手艾米-怀恩豪斯在伦敦一夜店现身，与其保镖团队其中的一名黑人约会调情，卿卿我我毫不避人。虽然刚刚离婚的怀恩豪斯一再宣称自己不想再找男朋友，但是被偷拍的照片却显示她很享受与新欢度过的浪漫时光。(Sally)	Sally,艾米-怀恩豪斯
昌平金隅万科城12月底推90平3居全款95折(图)金隅万科城项目位于北京市昌平城区内，原北京第二毛纺厂位置。项目所处区域包括的市政道路有八达岭高速、永安路、创新路、南环路、振兴路等。从北京市区通往项目的公交车有345、345快、919快、919支3、925区、919支1、919区等，345快每隔1分钟发车一班，高速直达。昌平城区内有491、492、21、376路等直达本项目，21路从城铁龙泽站直达本项目。金隅万科城项目处于昌平城区内的繁华地块，紧邻商业中心，区域发展成熟、配套非常完善。项目遵循新都市主义原则设计，倡导社区与自然的融合渗透，营造充满阳光和绿色的现代社区。在规划上充分利用场地的限高要求，通过现代的规划理念和手法来构建高规格的理想化人居空间，将成为地标性的建筑综合体，树立起昌平的城市新形象。以上信息仅供参考，最终以开发商公布为准。点击查看更多楼盘开盘信息	
考研网站出现假文凭广告引网友热议-新快报记者邓毅富《研究生招生网与作弊答案和假学历同行》，10月31日，猫扑网站一个名为“今天你干了CLY”的网友加了这样一个帖子。“今天你干了CLY”说的网站，是指“中国研究生招生信息网”，据截图显示，网站网页点开帖子以后，在右边一栏中，出现谷歌网站的随机广告，广告的内容是贩卖假文凭和考试答案。此事引起了网友们的热议，有人认为，这跟网站无关，因为是谷歌广告附带随机生成的；也有人认为，网站有拒绝不恰当广告的责任。考研网站出现“一条龙服务”引网友热议页面内容很“雷”人“今天闲来无聊，浏览了一下‘中国研究生招生信息网’，在里面看到一些信息，用现在流行的话来说，就是‘很雷’——该网的招生信息和作弊答案、假学历广告竟出现在同一页面上”。10月31日，网友“今天你干了CLY”在猫扑网上加了这样一个帖子，并提供了截图。截图的页面显示：在打开一条《研究生网报31日结束11月10日至14日现场确认》的帖子之后，页面右边有一栏广告。这个广告称：“速取本科、研究生(真实学历)”，并附带了联系电话；另一条广告称：“研究生考试答案QQ×××××××××”，该广告还细分为“09考研过关”和“考研过关”两项，并都附带上QQ号码。记者找到了“中国研究生招生信息网”，按图索骥,发现情况果然如网友“今天你干了CLY”所说。“中国研究生招生信息网”的主管单位是“教育部高校学生司”、主办单位是“全国高等学校学生信息咨询与就业指导中心”、承办单位是“学信咨询服务有限公司”。从网站内容看，它内容丰富，除了教育部和各地的招生考试信息外，还有网上报名考研的功能，人气相当热。而网友“今天你干了CLY”披露的考试作弊广告就出现在与“考研动态”的各篇文章的同一网页的右边栏广告位置上，并有“Google提供的广告”等字样。网站广告谁负责任？对于作弊广告究竟是不是“中国研究生招生信息网”的责任，网友们展开了热议。网友“半导体”认为：“页面旁边是谷歌的广告栏，这事要找谷歌，广告投放内容是由谷歌决定的。谷歌的广告是根据网站的内容自动匹配相关的广告的。”而一位自称是做网络广告的网友“理更深的蓝”则指出：“这是谷歌的网络广告，网站是有权利是否投放广告产生盈利，但没有权利屏蔽内容。只要广告主肯付钱。出现这样的情况首先一点是谷歌没有做好内容屏蔽；二是网站为了盈利投放广告。双方都负有责任。”网友“山夫”则认为这个广告只是“骗钱”：“说白了骗傻瓜和求捷径人的钱，钱汇出去了，就没有回音。”网友“红风车”则称：“一切皆有可能嘛，中国是块神奇的土壤。”网友“路过红尘”说：“我老婆在东北某知名大学读研，惊奇地发现自己是寝室唯一一个不买答案考上的……”网友“laijiaxing2002”则调侃说：“谷歌的广告是很公正的，这则广告绝对是与该网页内容相关程度最高的产品，很真实，很好地反映了社会的和谐、自然的和谐、万物相生相克。”网友“路了卿”则爆料：“中国社会资源和保障部，就是国家公务员考试网上还有卖答案的，真令人崩溃了……”网友“良民良言”由此表达了自己对考研的不信任：“我已经发狂了，现在我看到称自己是研究生的人我也不把当他研究生了。”但网友“茶煲”则认为这只是极个别的现象：“一般说来，重点院校的研究生录取还是很公平的，即使是本校的学生考取本校的研究生也是十分辛苦的。”而大部分网友也表示了深深的忧虑:“这样子只会给想不劳而获的人提供了捷径，而一个号称正规教育的官方网站，竟然对这样的广告不管不问，以后谁会相信文凭跟学历的纯洁？”	邓毅富
