content	person
大摩：中移动入股浦发行阻碍派息摩根士丹利表示，相信中移动<00941.HK>入股浦发行，可透过开发移动财务应用，加强和获得协同效应。不过，相信投资会带出一些关注：(一)估计入股浦发行20%，今明两年每股盈测仅可提升2.1%及2.7%(与回购股份相若)，以及目标价会减少至81.5元；(二)新兴市场移动银行成功例子很少，该行亦没有信心入股浦发行20%，便足以助其发行移动银行平台。该行相信与相对大银行的伙伴关系，将有助中移动获得更好的平台，为进一步发展应用；(三)反映中移动寻找于电讯以外收购，可能阻止公司增加派息。评级“与大市同步”，目标价84元。	
太古地产下周进上市聆讯新浪财经讯4月8日消息，踏入第二季，新股陆续有来。市场消息透露，由太古(0019)分拆的太古地产将于下周四(15日)进行上市聆讯。据香港媒体报道，踏入第二季，新股陆续有来。市场消息透露，由太古(0019)分拆的太古地产将于下周四(15日)进行上市聆讯，估计集资约300亿元，保荐人为高盛、汇丰及摩根士丹利。此外，市传集资约15.6亿元的雷士照明，计划在本月26日正式推介，并于5月6日起公开招股，14日挂牌；内地包装纸制造商优源国际亦拟于第二季来港上?。此外，有指今年2月因市况欠佳而搁置上市的思嘉集团，有意于日内卷土重来。法国护肤品品牌欧舒丹(L'Occitane)已于昨日开始进行初步推介，暂定本月19日正式推介，26日起招股，消息指其初步集资约31.2亿至46.8亿元；保荐人为瑞银、汇丰、里昂。欧舒丹为卢森堡注册的公司。农行邀21投行提IPO建议另据彭博引述知情人士称，农业银行邀请20多家银行，竞标承办其在内地和香港的A＋H股上市事宜。消息称，农行在4月2日向21家银行发出提供香港IPO建议的邀请，其中包括一些有资格安排内地上市的外资公司在内的10家银行，获邀竞争保荐内地上市。消息说，农行在邀请文件中没有透露IPO的时间和规模。之前有报道称，农行的A＋H集资可能达2,000亿元人民币(293亿美元)。在内地和香港发行如此大规模的股票，将使得农行的IPO成为世界之最，超过其更大的同业工商银行(1398)在2006年上市时的220亿美元。	
不可不知的3D《赤壁OL》小秘密一很多玩家在游戏中会经常遇到各种问题，纯靠自我摸索有点费时费力，这里列出客服MM花花公主总结的一些疑难杂症的解决办法，希望能对各位朋友有所裨益！1.不显示人物和NPC:您可以在设置中的【显示方案】中来根据需要调整，按9快捷键也可立即恢复，如果客户端不是最新的，需要更新客户端就能解决2.人多怪少：可以先去城里做些每日的任务。如【义】【军】【某某捕头】那里，或是先进副本和朋友组队做任务3.联通连不上：联通的用户必须修改游戏菜单主界面的网络连接方式，默认的是WAP的，您必须换成CMNET的，如果还是连不上，就是当地联通的问题。请在浏览器输入WWW.IP138.COM,告诉我你的IP地址。我们会再和当地的联通公司协调的。4.卡的问题：在菜单中的【设置】中选择第一行的【显示方案】选择要屏蔽的项目，还有开武器发光的玩家最好能关了，3D的用户如果还觉得卡。建议您先玩2D版本。3D版本我们会不断优化，可以等3D顺畅了再换回3D。还有把手机的缓存清理下，找个信号好的地方都能有效缓解卡的问题！5.找不到演武师/督导官：在各国的主城里都有，新手村得去到驿那里，回到主城。6.怎么寻径到某城：方法①在7地图中》1自动寻径》第一行常用位置寻航》方法②在更多》帮助》查看赤壁清单》查看池城》找各个国家的各个城市就可寻径了7.某个副本怎么进入：在更多》帮助》查看赤壁清单》战场列表》按你所在国家选择即可寻径到进入战场的NPC,最好组队做副本8.某个药材/矿石/掉落物寻径：也在更多》帮助》查看赤壁清单》矿物/草药/掉落物品列表即可寻径！或者询问副将和子嗣9.结义的要求：15级以上的玩家可以申请，需要2个好友(没有等级限制)支持才能成立，加入结义之后可以获得很多好处10.结婚的要求：两个异性二级好友可以结婚，得先购买结婚证，结婚之后组队战斗可以获得额外的奖励新3D《赤壁OL》带您迈入千年之前的那段传奇！更多资讯请手机访问官网g2us.cn及合作网站！	
佳华百货预计2010年盈利本报讯香港上市公司佳华百货控股董事会昨日发布公告称，预计2010年公司业绩将录得盈利。早前有报导指，佳华管理层表示将抓住利好势头，希望5年内能在全国范围内增开50至80间分店，每年销售金额达到50至80亿人民币。佳华百货在2009年为进行业务结构调整，一次性拨备4091.8万元人民币关闭了两家亏损门店，并对其他门店进行全面装修，如撇除有关拨备，公司业绩明显改善，2010年营业额持续上扬。事实上，公司财务状况一直十分良好，2010年上半年资产负债率不到38%，公司可用于营业费用的流动资金更高达2.49亿港币。加之在港上市时筹得的3亿港币，目前只用了1.3亿。由此可见，佳华目前的有充足的资金全力发展、扩大业务。近期佳华股价一路上扬，日前更冲上1.03高位。相比09年同期业绩亏损报告，今年业绩录得盈利相信令投资者们信心大增，未来发展空间进一步扩大。(谢诚)欢迎发表评论我要评论	谢诚
民警赤手抓捕持刀狂徒被刺身亡(组图)20日晚8时许，涪陵区人民西路，一名歹徒当街连刺4人后逃跑，被敦仁派出所户籍民警周鑫撞见。周鑫徒手实施抓捕，被歹徒刺伤后捂住胸口紧追歹徒44米，倒地牺牲。英雄简历周鑫，1979年1月6日出生，1999年8月参加公安工作，2002年入党，大学本科学历，一级警司。■受害人：歹徒当街一连刺伤4人20日晚8时，涪陵区人民西路46号彩票投注站老板况龄松正关门回家，一名男青年从梯坎跳下，按住他肩膀。况感觉左大腿被扎了一下，没等他反应过来，男子已逃跑。况脱下外裤，发现左腿部有1.5厘米长的刀伤。“快报警！这崽儿已经刺杀了2人。”群众向况大喊。救治3名受害者的人民西路16号一家诊所称，第一个受害人文先生40岁左右，在涪陵区人民医院二门诊旁被刺伤；第二个受害人曾先生，在人民西路一家烟草专卖店前被刺伤；文、曾受伤的部位都是大腿，伤口均长1.5厘米，深约1.5厘米。记者了解到，3受害人遇刺间隔不到5分钟。经过清创、包扎处理，3人已无大碍。市公安局昨日通报，此前，歹徒还当街刺伤另一行人。■目击者：负伤民警紧追歹徒44米目击者钟女士介绍，歹徒刺伤况龄松后，挥舞刀子，顺着人民西路往南门山方向逃跑，群众大喊：“杀人了，抓住他。”歹徒跑到敦仁派出所附近时，一穿便衣的瘦弱青年大吼一声：“站住！我是警察！”徒手去抓歹徒。歹徒挣脱，举刀向瘦弱青年一阵乱刺。搏斗持续10多秒后，瘦弱青年捂住胸腹部，一边紧追歹徒，一边高喊“抓住他”。钟女士说，追出44米后，瘦弱青年倒在地上，再也没有站起来。穿制服的民警赶来，扶起瘦弱青年，大叫：“快叫救护车，他是我们敦仁所的干警周鑫。”钟这才知道，瘦弱男子就是敦仁派出所的户籍警周鑫。当晚8时许，一直在加班的周鑫走出派出所吃东西，正遇到群众在喊抓歹徒。民警和群众将周鑫送医院救治，由于伤势过重，流血过多，周鑫抢救无效英勇牺牲。参与抢救的涪陵区急救中心医生表示，周鑫负伤后如果不继续追击，或许失血不会这么多，抢救希望会大一些。■追捕：40分钟后捕获嫌疑人案发生后，涪陵警方迅速调集力量拉网布控。当晚8时40分，民警在松翠路石油公司宿舍嫌疑人邵骜杰的家中，将他抓获。警方从邵骜杰家搜出刀具一把，经监控对比，初步证实该刀正是刺杀民警等5人的凶器。据查，邵骜杰18岁，无业，是名吸毒者，曾两次被警方查处，此次作案动机有待进一步审理。周鑫抓歹徒牺牲的消息，很快传遍涪陵城。昨上午9时到昨晚7时许，陆续有上千市民自发前往涪陵区殡仪馆吊唁。英雄追记一等功还将申报烈士和一级英模昨日凌晨，受市公安局党委书记王立军的委托，市公安局领导王华刚、杨增渝、王廷彦连夜赶往涪陵区，看望和慰问周鑫的亲属。昨下午3时许，王立军搭乘直升机前往涪陵，看望慰问了周鑫的亲属。王立军对善后工作明确指示：“不能让英雄流血又流泪。”昨下午4时许，市公安局向媒体通报称，为周鑫追记一等功。涪陵区政府表示，正积极准备材料，为周鑫申报革命烈士。市公安局还表示，还将为周鑫向公安部申授一级英模。据了解，此前，单位已为周鑫向平安保险公司投保工伤意外险。昨上午，该保险公司涪陵中心总经理钟建表示，20万元工伤意外伤害保额将在后天转到周鑫的受益人账户上。疑犯外婆：初二缀学混迹社会曾经多次刺伤他人昨上午，记者找到邵骜杰的外婆张婆婆。她说，尚不知道外孙吸毒。邵骜杰的爸妈离婚后，就疏于照顾他。邵从读初二开始混迹社会。前日下午，邵骜杰从松翠路的住处来找她。离开时，她把邵送到楼下，看着他上了车。张婆婆解释，之所以这么做，是因为邵骜杰有臆想症，平时在街头看到谁长时间打电话或者高声叫喊，他便认为是在骂他，他就会去伤害人家。邵骜杰有暴力倾向是从去年开始的。张婆婆说，之前先后被他用小刀刺伤的人就有四五个，去年曾伤了一邓姓居民，赔款至今没还清。因邵骜杰的父母一直联系不上，其爷爷奶奶也搬离原来住所。截至昨下午6时，记者未能找到邵骜杰的其他亲人。追忆英雄父母：“为你自豪为你骄傲”哀乐声中，灵柩前，周鑫的爸爸强忍着泪水招呼客人。他说，儿子选择当人民警察，就要随时做好牺牲的准备。周爸爸在清溪镇派出所工作，妈妈在焦石开诊所，长期两地分居，周鑫小时候没得到很好的照顾。现在眼看自己要退休了，儿子却走了……儿子的离去，周妈妈同样选择了坚强。她说：“儿子，我不哭，我要为你自豪，为你骄傲，不能哭。”但是周妈妈还是哭了，而且哭肿了双眼。同事：“对得起这身警服”周鑫的同事冯文波说，辖区居民吴婆婆是个孤寡老人，已经90多岁了，沟通起来很吃力，但是周鑫每周都去吴婆婆家看看，聊聊天，吴婆婆见人就夸“周户籍”。冯文波说，周鑫在所里话不多，但在接待群众问询或求助时话特多，甚至不厌其烦。现在回忆起来，他在践行他曾说过的一句话——“做事要对得起这身警服。”爱妻：“我还等着你吃晚饭”英雄的爱妻蹇政敏已经吐词不清，她向记者哭着说了和丈夫相识相爱、共同经历的过程。她说，去年8月，两人的爱情结晶女儿降临，一家开始了甜蜜的三口生活。“你让我怎么跟幺儿交代啊？你不是说要教她唱爸爸好么？”蹇政敏再次呜咽起来。事发当天早上，周鑫7点多钟就离家了，说是派出所里当天有很多事要做。当晚7点多，他还和蹇政敏通了电话，说资料还没整理完，晚点回来吃饭，让她不等了。她还说：“周末了，多等会吧！早点回来。”不料这一等，等来的是护士的电话。蹇政敏飞奔到医院，爱人已是双眼紧闭。“我还等着你吃晚饭……”蹇政敏再次放声痛哭。本版稿件由记者夏祥洲采写	周爸爸,周鑫,邵骜杰,周妈妈,钟建,王立军,况龄松,蹇政敏,冯文波,王华刚,杨增渝,王廷彦,曾先生,文先生
两名外籍援助人员在索马里中部遭绑架新华网摩加迪沙10月25日电(报道员瓦尔萨迈)索马里中部地区地方政府官员及当地一家非政府组织援助机构25日说，两名外籍援助人员当天在索中部遭不明身份武装分子绑架。这家机构工作人员对新华社报道员说，这两名来自丹麦一家非政府排雷机构的援助人员当天在索马里中部城镇加尔加尤附近地带被绑架，事发时两人正由加尔加尤镇南部前往当地机场途中。目前被绑人员的性别及国籍尚未确认。但有当地民众称，被绑人员为一男一女。另有一位不愿透露姓名的地方政府官员表示，被绑人员均为丹麦人。截至目前，尚无组织或个人声称对该事件负责。索马里自1991年政府被推翻后长期处于无政府状态。成立于2004年的过渡政府无力有效控制全国，中部及南部很多地区长期被反政府武装控制。2008年及2009年，索中部及南部曾发生多起外国援助人员被绑架事件。	
下跌市股东增持逾3亿股94%获利《投资者报》分析员杨秀红股指节节败退，股东增持潮纷至沓来。自4月16日股指期货推出，A股市场就一直在震荡下跌中。上证综指4月及5月跌幅约分别达到8%和10%。市场大跌两市哀鸿遍野之际，上市公司股东逆市增持的消息却不断传来，很多忍不住减仓的投资者开始犹豫。据《投资者报》数据研究部的统计，4月以来，上市公司股东已增持逾3亿股，其中5月增持市值超越减持市值，一举实现净增值。2008年10月浮现以来，时隔19个月，这一现象再度重现。观察本轮增持潮背后的“推手”，上市公司的高管表现得热情很高，多家公司出现10余位高管集体增持的场面。不过各家高管的增持数量则是“雷声大雨点小”，大部分高管增持数量均在10万股以下。真正进行大规模增持的，则是“公司”类股东，其增持数量占到本轮增持总量的九成以上。在激进增持后，上市公司股东多有斩获，增持股票在4月及5月的大跌市中大面积逆市上扬、为其带来不菲的账面浮盈。5月增持量创19个月新高据《投资者报》数据研究部统计，今年以来，以月度为单位，在1月累计公告增持数量超过1亿股后，2、3月份迅速萎缩到不足873万股和212万股。伴随着4月以来市场的急速下挫，上市公司股东月度增持规模出现了大规模回升。其中，4月公告增持数量达到2199万股，环比增长逾9倍。此后，在股市继续下探寻底的5月，更是涌现出少有的增持潮，其月度增持数量一举攀升到3亿股左右，环比飙升逾12倍，这是继2009年9月之后，增持数量再度接近3亿股大关。历史上月增持数量超过3亿股的月份也仅有10余个。与此同时，上市公司股东公告增持市值也随之出现大幅波动：1月增持市值创出小新高，接近16亿元，而2月、3月增持市值则下滑到2.8亿元和0.3亿元。随着4月、5月增持潮的涌现，股东公告增持市值也分别回升至3.5亿元和32亿元。截至6月15日，4月以来上市公司股东已经合计增持约3.2亿股，增持市值超过35亿元。在5月汹涌的增持潮和减持规模退潮的背后，催生了罕见的净增持现象。据我部统计，5月股东累计公告增持市值接近32亿元，一举超越同期约19亿元的公告减持规模。Wind资讯统计显示，以月度为单位，A股市场上次出现股东净增持的时间为2008年10月份，当月上市公司股东合计公告增持市值为11亿元，公告减持市值为10亿元。这意味着，时隔19个月后，A股市场股东再现净增持现象。且今年5月股东净增持规模比2008年10月股市见底之时的势头更猛烈。据我们此前的统计，上市公司股东增持潮一般在市场筑底阶段出现，如2005年10月、2008年9月等。此次，大股东再次推动新一轮增持潮，无疑给处于“熊途”的投资者一线希望。长江电力再成增持主要目标观察本轮增持潮背后的主要“幕后推手”，无外乎三大主力，即公司、高管和个人。按增持股东类型(公司、高管、个人)划分，4月以来发布的78次增持公告中，有71次增持出自高管和公司之手，占总数的91%。其中，高管公告增持次数达到46次，居首位。有多家公司涌现了众多高管一齐增持的局面。如南通科技、长航油运、柳化股份等，其背后增持的高管多达10余位。其中，长航油运增持公告显示，5月13日、14日，包括该公司董事长刘锡汉、副董事长朱宁、总经理李万锦等在内的13位高管对自家股票进行了回购，其合计购入股票数量约57万股，成交价格在5.37元至5.5元之间。柳化股份增持公告也显示，5月13日、14日，公司董事长廖能成、副董事长、总经理覃永强、董事苏东升等10位高管共计购入约67万股。每位上市公司高管增持数量，大部分都在10万股以下，多数只购入两三万股；5月增持最多的高管——宗申动力的董事长左宗申增持100万股，增持市值仅为1015万元，且所有高管的增持数量仅390万股，占4月以来总增持量的1.2%，增持势头明显是“雷声大雨点小”。相对于高管的增持，一些“公司”类股东显得较为激进。4月以来累计以“公司”身份增持的股东有16家，合计增持数量达到3.1亿股，合计增持市值达到34.6亿元，占总数的98%。据Wind数据统计，4月公告增持的公司有两家，分别为冀东水泥和中兴商业，5月公告增持的公司则迅速攀升到22家，增持数量最多前两家为长江电力和国电电力。前者的大股东长江三峡集团合计公告增持超1亿股，增持市值逾14亿元；后者的大股东中国国电集团公司合计买入8153万股，公告增持市值达5.43亿元。作为增持主力军，长江电力并非第一次担当月度增持冠军的角色。在今年1月的增持中，长江电力控股股东长江三峡集团就在当月增持了1亿多股，成为当月增持的领军人物。历史上的增持潮中，该集团曾多次出手，大规模回购自家股票。如2009年8月的超千万股增持，2006年7月的近2亿股的增持等。本轮增持潮股东94%获利我部统计了始于今年4月的这场增持潮中股东们的“账单”，结果显示多数股东获得了不错的回报。在4月以来的78次增持公告中，我们剔除了实际发生在今年二季度以前的增持行为。其中，国电电力、海信电器和柳化股份等三家公司，因为在股东增持之后实施了分红送配方案，我们根据其送转方案另行计算了其账面盈亏情况。对于其余上市公司，我们均按照股东平均增持成本及最新股价(6月11日收盘价，下同)的差价测算。最终测算结果显示，94%的增持为其股东带来正收益。在今年5月进行增持且在5月发布增持公告的公司中，海信电器股东青岛海信电子公司的盈利幅度最大，达到26%。此外，宗申动力、上海金陵、南通科技等也为其增持股东带来了超10%的正收益。	覃永强,刘锡汉,李万锦,杨秀红,廖能成,朱宁,左宗申,苏东升
烟台海景房龙湖葡醍海湾待推别墅350万起售新浪房产讯(编辑张跃)龙湖·葡醍海湾(论坛相册户型样板间点评地图搜索)项目预计2011年7月中下旬开盘，户型为100-300平米别墅，送100-200平米花园及2个车位。起价350万/套，均价390万/套。预计2013年年底入住。项目一期占地45万平米，建筑面积36万平米，容积率0.76，绿化率达到了60%。龙湖·葡醍海湾项目位于山东烟台滨海道，北临大海，与国家4A级风景区养马岛隔海相望，距烟台机场约25分钟车程。南邻城市景观大道，向西直达烟台市中心及政务区，向东连通烟威高速。以上信息仅供参考，最终以开发商公布为准。本稿件为新浪乐居独家原创稿件，版权所有，引用或转载请注明出处。订阅会员置业刊我们将直接把最新的热盘动向发送到您的邮箱更多热盘推荐：准新人必看低月供2居婚房房山两大置业热门区域——良乡、长阳六环内精装现房全搜罗南北通透板楼2-3居京城最火热盘TOP100本月入市新盘不漏看	
